[
  {
    "kind": "osdu:wks:master-data--Wellbore:1.0.0",
    "acl": {
      "owners": [
        "data.default.owners@hugin.example.com"
      ],
      "viewers": [
        "data.default.viewers@hugin.example.com"
      ]
    },
    "legal": {
      "legaltags": [
        "hugin-placeholder-legal-tag"
      ],
      "otherRelevantDataCountries": [
        "NO"
      ],
      "status": "compliant"
    },
    "id": "hugin:master-data--Wellbore:15%2F9-F-1%20C",
    "version": 1,
    "data": {
      "FacilityName": "15/9-F-1 C",
      "FacilityID": "15/9-F-1 C",
      "Source": "Equinor Volve open dataset, via HUGIN",
      "WellID": "hugin:master-data--Well:15%2F9-F-1",
      "FacilityStates": [
        {
          "FacilityStateTypeID": "namespace:reference-data--FacilityStateType:Injecting:",
          "EffectiveDateTime": "2014-04-07T00:00:00Z",
          "TerminationDateTime": "2014-04-08T00:00:00Z"
        }
      ],
      "NameAliases": [
        {
          "AliasName": "NO 15/9-F-1 C",
          "AliasNameTypeID": "namespace:reference-data--AliasNameType:DDR:"
        },
        {
          "AliasName": "15/9-F-1 C",
          "AliasNameTypeID": "namespace:reference-data--AliasNameType:PROD:"
        },
        {
          "AliasName": "NO 15/9-F-1 C",
          "AliasNameTypeID": "namespace:reference-data--AliasNameType:PROD:"
        }
      ],
      "ExtensionProperties": {
        "SidetrackCode": "C",
        "IdentityVariantCount": 3,
        "SourceSystemCount": 2,
        "WellRole": "INJECTOR"
      }
    }
  },
  {
    "kind": "osdu:wks:master-data--Wellbore:1.0.0",
    "acl": {
      "owners": [
        "data.default.owners@hugin.example.com"
      ],
      "viewers": [
        "data.default.viewers@hugin.example.com"
      ]
    },
    "legal": {
      "legaltags": [
        "hugin-placeholder-legal-tag"
      ],
      "otherRelevantDataCountries": [
        "NO"
      ],
      "status": "compliant"
    },
    "id": "hugin:master-data--Wellbore:15%2F9-F-1%20C",
    "version": 2,
    "data": {
      "FacilityName": "15/9-F-1 C",
      "FacilityID": "15/9-F-1 C",
      "Source": "Equinor Volve open dataset, via HUGIN",
      "WellID": "hugin:master-data--Well:15%2F9-F-1",
      "FacilityStates": [
        {
          "FacilityStateTypeID": "namespace:reference-data--FacilityStateType:Producing:",
          "EffectiveDateTime": "2014-04-08T00:00:00Z",
          "TerminationDateTime": "2014-07-07T00:00:00Z"
        }
      ],
      "NameAliases": [
        {
          "AliasName": "NO 15/9-F-1 C",
          "AliasNameTypeID": "namespace:reference-data--AliasNameType:DDR:"
        },
        {
          "AliasName": "15/9-F-1 C",
          "AliasNameTypeID": "namespace:reference-data--AliasNameType:PROD:"
        },
        {
          "AliasName": "NO 15/9-F-1 C",
          "AliasNameTypeID": "namespace:reference-data--AliasNameType:PROD:"
        }
      ],
      "ExtensionProperties": {
        "SidetrackCode": "C",
        "IdentityVariantCount": 3,
        "SourceSystemCount": 2,
        "WellRole": "PRODUCER"
      }
    }
  },
  {
    "kind": "osdu:wks:master-data--Wellbore:1.0.0",
    "acl": {
      "owners": [
        "data.default.owners@hugin.example.com"
      ],
      "viewers": [
        "data.default.viewers@hugin.example.com"
      ]
    },
    "legal": {
      "legaltags": [
        "hugin-placeholder-legal-tag"
      ],
      "otherRelevantDataCountries": [
        "NO"
      ],
      "status": "compliant"
    },
    "id": "hugin:master-data--Wellbore:15%2F9-F-1%20C",
    "version": 3,
    "data": {
      "FacilityName": "15/9-F-1 C",
      "FacilityID": "15/9-F-1 C",
      "Source": "Equinor Volve open dataset, via HUGIN",
      "WellID": "hugin:master-data--Well:15%2F9-F-1",
      "FacilityStates": [
        {
          "FacilityStateTypeID": "namespace:reference-data--FacilityStateType:Injecting:",
          "EffectiveDateTime": "2014-07-07T00:00:00Z",
          "TerminationDateTime": "2014-07-08T00:00:00Z"
        }
      ],
      "NameAliases": [
        {
          "AliasName": "NO 15/9-F-1 C",
          "AliasNameTypeID": "namespace:reference-data--AliasNameType:DDR:"
        },
        {
          "AliasName": "15/9-F-1 C",
          "AliasNameTypeID": "namespace:reference-data--AliasNameType:PROD:"
        },
        {
          "AliasName": "NO 15/9-F-1 C",
          "AliasNameTypeID": "namespace:reference-data--AliasNameType:PROD:"
        }
      ],
      "ExtensionProperties": {
        "SidetrackCode": "C",
        "IdentityVariantCount": 3,
        "SourceSystemCount": 2,
        "WellRole": "INJECTOR"
      }
    }
  },
  {
    "kind": "osdu:wks:master-data--Wellbore:1.0.0",
    "acl": {
      "owners": [
        "data.default.owners@hugin.example.com"
      ],
      "viewers": [
        "data.default.viewers@hugin.example.com"
      ]
    },
    "legal": {
      "legaltags": [
        "hugin-placeholder-legal-tag"
      ],
      "otherRelevantDataCountries": [
        "NO"
      ],
      "status": "compliant"
    },
    "id": "hugin:master-data--Wellbore:15%2F9-F-1%20C",
    "version": 4,
    "data": {
      "FacilityName": "15/9-F-1 C",
      "FacilityID": "15/9-F-1 C",
      "Source": "Equinor Volve open dataset, via HUGIN",
      "WellID": "hugin:master-data--Well:15%2F9-F-1",
      "FacilityStates": [
        {
          "FacilityStateTypeID": "namespace:reference-data--FacilityStateType:Producing:",
          "EffectiveDateTime": "2014-07-08T00:00:00Z"
        }
      ],
      "NameAliases": [
        {
          "AliasName": "NO 15/9-F-1 C",
          "AliasNameTypeID": "namespace:reference-data--AliasNameType:DDR:"
        },
        {
          "AliasName": "15/9-F-1 C",
          "AliasNameTypeID": "namespace:reference-data--AliasNameType:PROD:"
        },
        {
          "AliasName": "NO 15/9-F-1 C",
          "AliasNameTypeID": "namespace:reference-data--AliasNameType:PROD:"
        }
      ],
      "ExtensionProperties": {
        "SidetrackCode": "C",
        "IdentityVariantCount": 3,
        "SourceSystemCount": 2,
        "WellRole": "PRODUCER"
      }
    }
  },
  {
    "kind": "osdu:wks:master-data--Wellbore:1.0.0",
    "acl": {
      "owners": [
        "data.default.owners@hugin.example.com"
      ],
      "viewers": [
        "data.default.viewers@hugin.example.com"
      ]
    },
    "legal": {
      "legaltags": [
        "hugin-placeholder-legal-tag"
      ],
      "otherRelevantDataCountries": [
        "NO"
      ],
      "status": "compliant"
    },
    "id": "hugin:master-data--Wellbore:15%2F9-F-14",
    "version": 1,
    "data": {
      "FacilityName": "15/9-F-14",
      "FacilityID": "15/9-F-14",
      "Source": "Equinor Volve open dataset, via HUGIN",
      "WellID": "hugin:master-data--Well:15%2F9-F-14",
      "FacilityStates": [
        {
          "FacilityStateTypeID": "namespace:reference-data--FacilityStateType:Producing:",
          "EffectiveDateTime": "2008-06-01T00:00:00Z"
        }
      ],
      "NameAliases": [
        {
          "AliasName": "15/9-F-14 - Main Wellbore",
          "AliasNameTypeID": "namespace:reference-data--AliasNameType:TRAJ:"
        },
        {
          "AliasName": "NO 15/9-F-14",
          "AliasNameTypeID": "namespace:reference-data--AliasNameType:WITSML:"
        },
        {
          "AliasName": "15/9-F-14",
          "AliasNameTypeID": "namespace:reference-data--AliasNameType:PROD:"
        },
        {
          "AliasName": "NO 15/9-F-14 H",
          "AliasNameTypeID": "namespace:reference-data--AliasNameType:PROD:"
        },
        {
          "AliasName": "NO 15/9-F-14",
          "AliasNameTypeID": "namespace:reference-data--AliasNameType:DDR:"
        }
      ],
      "ExtensionProperties": {
        "IdentityVariantCount": 5,
        "SourceSystemCount": 4,
        "WellRole": "PRODUCER"
      }
    }
  },
  {
    "kind": "osdu:wks:master-data--Wellbore:1.0.0",
    "acl": {
      "owners": [
        "data.default.owners@hugin.example.com"
      ],
      "viewers": [
        "data.default.viewers@hugin.example.com"
      ]
    },
    "legal": {
      "legaltags": [
        "hugin-placeholder-legal-tag"
      ],
      "otherRelevantDataCountries": [
        "NO"
      ],
      "status": "compliant"
    },
    "id": "hugin:master-data--Wellbore:15%2F9-F-11",
    "version": 1,
    "data": {
      "FacilityName": "15/9-F-11",
      "FacilityID": "15/9-F-11",
      "Source": "Equinor Volve open dataset, via HUGIN",
      "WellID": "hugin:master-data--Well:15%2F9-F-11",
      "FacilityStates": [
        {
          "FacilityStateTypeID": "namespace:reference-data--FacilityStateType:Producing:",
          "EffectiveDateTime": "2013-07-08T00:00:00Z"
        }
      ],
      "NameAliases": [
        {
          "AliasName": "NO 15/9-F-11",
          "AliasNameTypeID": "namespace:reference-data--AliasNameType:DDR:"
        },
        {
          "AliasName": "15/9-F-11",
          "AliasNameTypeID": "namespace:reference-data--AliasNameType:PROD:"
        },
        {
          "AliasName": "NO 15/9-F-11 H",
          "AliasNameTypeID": "namespace:reference-data--AliasNameType:PROD:"
        }
      ],
      "ExtensionProperties": {
        "IdentityVariantCount": 3,
        "SourceSystemCount": 2,
        "WellRole": "PRODUCER"
      }
    }
  },
  {
    "kind": "osdu:wks:master-data--Wellbore:1.0.0",
    "acl": {
      "owners": [
        "data.default.owners@hugin.example.com"
      ],
      "viewers": [
        "data.default.viewers@hugin.example.com"
      ]
    },
    "legal": {
      "legaltags": [
        "hugin-placeholder-legal-tag"
      ],
      "otherRelevantDataCountries": [
        "NO"
      ],
      "status": "compliant"
    },
    "id": "hugin:master-data--Wellbore:15%2F9-F-4",
    "version": 1,
    "data": {
      "FacilityName": "15/9-F-4",
      "FacilityID": "15/9-F-4",
      "Source": "Equinor Volve open dataset, via HUGIN",